{
  "$schema": "https://json-schema.org/draft/2020-12/schema",
  "title": "event",
  "description": "The `event` content kind (megaplan 1.7 and task 8-A1): one Overlord event the Overlord Console can trigger on a picked spot of the active match area (blackout, EMP, airstrike, traffic jam, supply drop, weather, cyberpsychosis outbreak). One event per file. `cost` is paid in Threat Points when the event is queued. `warning_s` is the seconds between queueing and the hit, during which the players in the area get the sound and the marker (megaplan 8-O1 fairness: never below 3). `cooldown_s` is how long before this same event can be queued again. `radius` is the blocks around the picked spot the effect reaches. `scales_with_intensity` is true when the host-set intensity (Chill, Normal, Brutal) scales the strength of the effect (its counts, power and seconds). `night_city` is true when the event also reaches a host's own Cyberpunk game through the host's hacks, spawns and toggles (a blackout there is the real `blackout` hack, a traffic jam the real `gridlock`); it is skipped for a host whose matching guest toggle is off, and for everyone else the event plays in the replica only. `effect` is exactly one of the shapes below, chosen by `type`: blackout (the lights in the area go dark for `seconds`), emp (devices in the area stop answering and, with `cyberware_off`, a player's active implants go quiet, for `seconds`), airstrike (`strikes` explosions of `power` within `spread` blocks of the spot, one every `interval_ticks`; it never breaks blocks of the replica, section 1.6), traffic_jam (a gridlock of the area's traffic for `seconds`), supply_drop (a crate with `eddies` Minecraft eddies and the listed `items`), weather (the match area's weather becomes `weather` for `seconds`) and outbreak (`count` squads of the `spawn_palette` entry `spawn` rush the area; the Night City ones obey the same fairness rules as any spawn). Text is original and short. A file with the same id as a default replaces it.",
  "$defs": {
    "item": {
      "type": "string",
      "pattern": "^[a-z0-9_.-]+:[a-z0-9_./-]+$",
      "maxBytes": 128
    }
  },
  "type": "object",
  "required": [
    "schema",
    "name",
    "description",
    "cost",
    "warning_s",
    "cooldown_s",
    "radius",
    "scales_with_intensity",
    "night_city",
    "effect"
  ],
  "additionalProperties": false,
  "properties": {
    "schema": {
      "const": 1
    },
    "id": {
      "type": "string",
      "pattern": "^[a-z0-9_.-]+:[a-z0-9_./-]+$",
      "maxBytes": 128
    },
    "name": {
      "type": "string",
      "minLength": 1,
      "maxBytes": 48
    },
    "description": {
      "type": "string",
      "minLength": 1,
      "maxBytes": 200
    },
    "cost": {
      "type": "integer",
      "minimum": 1,
      "maximum": 100
    },
    "warning_s": {
      "type": "integer",
      "minimum": 3,
      "maximum": 30
    },
    "cooldown_s": {
      "type": "integer",
      "minimum": 0,
      "maximum": 900
    },
    "radius": {
      "type": "integer",
      "minimum": 4,
      "maximum": 128
    },
    "scales_with_intensity": {
      "type": "boolean"
    },
    "night_city": {
      "type": "boolean"
    },
    "effect": {
      "type": "object",
      "properties": {
        "spawn": {"type": "string", "pattern": "^[a-z0-9_.-]+:[a-z0-9_./-]+$", "maxBytes": 128, "x-ref": "spawn_palette"}
      },
      "oneOf": [
        {
          "type": "object",
          "required": ["type", "seconds"],
          "additionalProperties": false,
          "properties": {
            "type": {"const": "blackout"},
            "seconds": {"type": "integer", "minimum": 5, "maximum": 120}
          }
        },
        {
          "type": "object",
          "required": ["type", "seconds", "cyberware_off"],
          "additionalProperties": false,
          "properties": {
            "type": {"const": "emp"},
            "seconds": {"type": "integer", "minimum": 3, "maximum": 60},
            "cyberware_off": {"type": "boolean"}
          }
        },
        {
          "type": "object",
          "required": ["type", "strikes", "spread", "power", "interval_ticks"],
          "additionalProperties": false,
          "properties": {
            "type": {"const": "airstrike"},
            "strikes": {"type": "integer", "minimum": 1, "maximum": 20},
            "spread": {"type": "integer", "minimum": 2, "maximum": 32},
            "power": {"type": "number", "minimum": 1, "maximum": 4},
            "interval_ticks": {"type": "integer", "minimum": 2, "maximum": 40}
          }
        },
        {
          "type": "object",
          "required": ["type", "seconds"],
          "additionalProperties": false,
          "properties": {
            "type": {"const": "traffic_jam"},
            "seconds": {"type": "integer", "minimum": 10, "maximum": 300}
          }
        },
        {
          "type": "object",
          "required": ["type", "eddies", "items"],
          "additionalProperties": false,
          "properties": {
            "type": {"const": "supply_drop"},
            "eddies": {"type": "integer", "minimum": 0, "maximum": 2000},
            "items": {
              "type": "array",
              "maxItems": 8,
              "items": {
                "type": "object",
                "required": ["item", "count"],
                "additionalProperties": false,
                "properties": {
                  "item": {"$ref": "#/$defs/item"},
                  "count": {"type": "integer", "minimum": 1, "maximum": 64}
                }
              }
            }
          }
        },
        {
          "type": "object",
          "required": ["type", "weather", "seconds"],
          "additionalProperties": false,
          "properties": {
            "type": {"const": "weather"},
            "weather": {"enum": ["clear", "rain", "thunder"]},
            "seconds": {"type": "integer", "minimum": 30, "maximum": 600}
          }
        },
        {
          "type": "object",
          "required": ["type", "spawn", "count"],
          "additionalProperties": false,
          "properties": {
            "type": {"const": "outbreak"},
            "spawn": {"type": "string", "pattern": "^[a-z0-9_.-]+:[a-z0-9_./-]+$", "maxBytes": 128},
            "count": {"type": "integer", "minimum": 1, "maximum": 4}
          }
        }
      ]
    }
  }
}
